area|publico_alvo|servico|descricao|link_mte|link_mte|link_denuncia_cadastramento|email_solicitacoes|telefone_denuncia_informacoes
CGUD|trabalhadores|Agendamento para as Unidades Descentralizadas|Agendamento para atendimento presencial nas Unidades Descentralizadas para os serviços de Abono Salarial, Dúvidas sobre a Carteira de Trabalho, Orientação Trabalhista, RAIS e CAGED e Seguro-Desemprego|https://atendimento.trabalho.gov.br|https://saaweb.mte.gov.br|||
CGUD|trabalhadores|Dúvidas sobre o Abono Salarial|Dúvidas relacionadas sobre o abono salarial|https://atendimento.trabalho.gov.br|https://contatos.trabalho.gov.br|||
CGUD|trabalhadores|Dúvidas sobre a Carteira de Trabalho|Dúvidas relacionadas sobre a Carteira de Trabalho|https://atendimento.trabalho.gov.br|https://contatos.trabalho.gov.br|||
CGUD|trabalhadores|Trabalhador - Solicitar Vínculos RAIS Trabalhador - Solicitar alterações nos bancos de dados RAIS e CAGED|Solicitar vinculos de RAIS e solicitar alterações nos bancos de dados da RAIS e CAGED|https://atendimento.trabalho.gov.br|https://www.gov.br/pt-br/servicos/solicitar-vinculos-empregaticios-da-rais|||
CGUD|trabalhadores|Dúvidas de Registro Profissional e de Contratante|Dúvidas relacioandas a solicitação do Registro Profissional e de Contratante|https://atendimento.trabalho.gov.br|https://contatos.trabalho.gov.br|||
CGUD|trabalhadores|Dúvidas sobre o Seguro-Desemprego|Dúvidas relacionadas sobre ao Seguro-Desemprego|https://atendimento.trabalho.gov.br|https://contatos.trabalho.gov.br|||
